{
  "wizard_id": "partial-61f325ce",
  "name": "[IN PROGRESS]",
  "url": "https://studentaid.gov/loan-simulator/borrow-more/wizard/enrollment-info/program-info",
  "discovered_at": "2025-10-20 19:59:51.638846",
  "discovery_version": "1.0.0",
  "total_pages": 2,
  "pages": [
    {
      "page_number": 1,
      "page_title": "Enrollment Information - Current or Future",
      "url_pattern": "https://studentaid.gov/loan-simulator/borrow-more/wizard/enrollment-info/current-or-future",
      "fields": [
        {
          "label": "Are you borrowing more federal student loans for a current or future program of study?",
          "field_id": "enrollment_status",
          "selector": "#fsa_Radio_WizardFutureProgram",
          "field_type": "radio",
          "interaction": "javascript_click",
          "required": true,
          "example_value": "future",
          "notes": "Choose whether borrowing for current enrollment or future program",
          "repeatable": false,
          "min_instances": 0
        }
      ],
      "continue_button": {
        "text": "Continue",
        "selector": "#fsa_Button_WizardContinue",
        "selector_type": "css"
      }
    },
    {
      "page_number": 2,
      "page_title": "Program Information - Future Program",
      "url_pattern": "https://studentaid.gov/loan-simulator/borrow-more/wizard/enrollment-info/program-info",
      "fields": [
        {
          "label": "Program Type",
          "field_id": "program_type",
          "selector": "#fsa_Select_LoanSimulatorBorrowMoreWizardProgramInfoProgramType",
          "field_type": "select",
          "interaction": "select",
          "required": true,
          "example_value": "Bachelor's degree",
          "notes": "Angular dropdown - may require special handling. Use exact Unicode character (') in value.",
          "repeatable": false,
          "min_instances": 0
        },
        {
          "label": "Program Length",
          "field_id": "program_length",
          "selector": "#fsa_Select_LoanSimulatorBorrowMoreWizardProgramInfoProgramLength",
          "field_type": "select",
          "interaction": "select",
          "required": true,
          "example_value": "4 years",
          "notes": "Standard dropdown for program duration",
          "repeatable": false,
          "min_instances": 0
        },
        {
          "label": "Dependency Status",
          "field_id": "dependency_status",
          "selector": "#fsa_Radio_LoanSimulatorDependentStatus",
          "field_type": "radio",
          "interaction": "javascript_click",
          "required": true,
          "example_value": "dependent",
          "notes": "Determines if student is independent (24+, married) or dependent",
          "repeatable": false,
          "min_instances": 0
        },
        {
          "label": "School Location",
          "field_id": "school_location",
          "selector": "#fsa_Typeahead_LoanSimulatorBorrowMoreWizardIncomeSchoolState",
          "field_type": "text",
          "interaction": "fill_enter",
          "required": false,
          "example_value": "Illinois",
          "notes": "Optional typeahead field for state. Provides more accurate estimates.",
          "repeatable": false,
          "min_instances": 0
        },
        {
          "label": "School Name",
          "field_id": "school_name",
          "selector": "#fsa_Typeahead_LoanSimulatorBorrowMoreWizardSchoolName",
          "field_type": "text",
          "interaction": "fill_enter",
          "required": false,
          "example_value": "University of Illinois",
          "notes": "Optional typeahead field for school name. Provides more accurate estimates.",
          "repeatable": false,
          "min_instances": 0
        }
      ],
      "continue_button": {
        "text": "Continue",
        "selector": "#fsa_Button_WizardContinue",
        "selector_type": "css"
      }
    }
  ]
}