{
  "wizard_id": "loan-simulator-borrow-more",
  "name": "FSA Loan Simulator - Borrow More",
  "url": "https://studentaid.gov/loan-simulator/borrow-more/results/(resultsPanel:results-panel//infoPanel:info-panel)",
  "discovered_at": "2025-10-20T19:09:57.301098",
  "discovery_version": "1.0.0",
  "total_pages": 6,
  "pages": [
    {
      "page_number": 1,
      "page_title": "Enrollment Information - Current or Future Program",
      "url_pattern": "https://studentaid.gov/loan-simulator/borrow-more/wizard/enrollment-info/current-or-future",
      "fields": [
        {
          "label": "Are you borrowing more federal student loans for a current or future program of study?",
          "field_id": "enrollment_type",
          "selector": "#fsa_Radio_WizardFutureProgram",
          "field_type": "radio",
          "interaction": "javascript_click",
          "required": true,
          "example_value": "future",
          "notes": "For high school seniors, select 'future'. For current college students, select 'current'.",
          "repeatable": false,
          "min_instances": 0
        }
      ],
      "continue_button": {
        "text": "Continue",
        "selector": "#fsa_Button_WizardContinue",
        "selector_type": "css"
      }
    },
    {
      "page_number": 2,
      "page_title": "Program Information - Future Program Details",
      "url_pattern": "https://studentaid.gov/loan-simulator/borrow-more/wizard/enrollment-info/program-info",
      "fields": [
        {
          "label": "Program Type",
          "field_id": "program_type",
          "selector": "#fsa_Select_LoanSimulatorBorrowMoreWizardProgramInfoProgramType",
          "field_type": "select",
          "interaction": "select",
          "required": true,
          "example_value": "Associate degree",
          "notes": "Note: Some options contain special characters (') that may require exact text matching",
          "repeatable": false,
          "min_instances": 0
        },
        {
          "label": "Program Length",
          "field_id": "program_length",
          "selector": "#fsa_Select_LoanSimulatorBorrowMoreWizardProgramInfoProgramLength",
          "field_type": "select",
          "interaction": "select",
          "required": true,
          "example_value": "4 years",
          "repeatable": false,
          "min_instances": 0
        },
        {
          "label": "Dependency Status",
          "field_id": "dependency_status",
          "selector": "#fsa_Radio_LoanSimulatorDependentStatus",
          "field_type": "radio",
          "interaction": "javascript_click",
          "required": true,
          "example_value": "dependent",
          "notes": "Most high school seniors are dependent students",
          "repeatable": false,
          "min_instances": 0
        },
        {
          "label": "School Location",
          "field_id": "school_location",
          "selector": "#fsa_Typeahead_LoanSimulatorBorrowMoreWizardIncomeSchoolState",
          "field_type": "typeahead",
          "interaction": "fill_enter",
          "required": false,
          "example_value": "Illinois",
          "notes": "Optional - helps provide more accurate estimates",
          "repeatable": false,
          "min_instances": 0
        },
        {
          "label": "School Name",
          "field_id": "school_name",
          "selector": "#fsa_Typeahead_LoanSimulatorBorrowMoreWizardSchoolName",
          "field_type": "typeahead",
          "interaction": "fill_enter",
          "required": false,
          "example_value": "University of Illinois",
          "notes": "Optional - typeahead search for school names",
          "repeatable": false,
          "min_instances": 0
        }
      ],
      "continue_button": {
        "text": "Continue",
        "selector": "#fsa_Button_WizardContinue",
        "selector_type": "css"
      }
    },
    {
      "page_number": 3,
      "page_title": "Family Income - Dependent Student",
      "url_pattern": "https://studentaid.gov/loan-simulator/borrow-more/wizard/enrollment-info/family-income",
      "fields": [
        {
          "label": "How much money does your family make each year?",
          "field_id": "family_income",
          "selector": "#fsa_Select_BorrowMoreFamilyIncome",
          "field_type": "select",
          "interaction": "select",
          "required": true,
          "example_value": "$75,000 - $110,000",
          "notes": "This question appears only for dependent students. Income range helps estimate federal loan eligibility.",
          "repeatable": false,
          "min_instances": 0
        }
      ],
      "continue_button": {
        "text": "Continue",
        "selector": "#fsa_Button_WizardContinue",
        "selector_type": "css"
      }
    },
    {
      "page_number": 4,
      "page_title": "Borrow Amount - Expected Cost",
      "url_pattern": "https://studentaid.gov/loan-simulator/borrow-more/wizard/enrollment-info/borrow-amount",
      "fields": [
        {
          "label": "How much do you think you will need to pay for school?",
          "field_id": "borrow_amount",
          "selector": "#fsa_Input_BorrowAmount",
          "field_type": "text",
          "interaction": "fill",
          "required": true,
          "example_value": "25000",
          "notes": "Dollar amount without $ symbol. Typical range: $5,000-$50,000 per year",
          "repeatable": false,
          "min_instances": 0
        }
      ],
      "continue_button": {
        "text": "Continue",
        "selector": "#fsa_Button_WizardContinue",
        "selector_type": "css"
      }
    },
    {
      "page_number": 5,
      "page_title": "Personal Information - Income Info",
      "url_pattern": "https://studentaid.gov/loan-simulator/borrow-more/wizard/personal-info/income-info",
      "fields": [
        {
          "label": "What is your expected yearly salary?",
          "field_id": "expected_yearly_salary",
          "selector": "#fsa_Input_YearlySalary",
          "field_type": "text",
          "interaction": "fill",
          "required": false,
          "example_value": "45000",
          "notes": "Dollar amount without $ symbol. Can use school data to estimate. This step is optional (Skip This Step link available)",
          "repeatable": false,
          "min_instances": 0
        },
        {
          "label": "How much do you expect your income to grow by each year?",
          "field_id": "income_growth_rate",
          "selector": "#fsa_Input_IncomeGrowth",
          "field_type": "text",
          "interaction": "fill",
          "required": false,
          "example_value": "3",
          "notes": "Percentage without % symbol. Default is 3% (national average). This step is optional",
          "repeatable": false,
          "min_instances": 0
        }
      ],
      "continue_button": {
        "text": "Continue",
        "selector": "#fsa_Button_WizardContinue",
        "selector_type": "css"
      }
    },
    {
      "page_number": 6,
      "page_title": "Loan Information - Current Loans",
      "url_pattern": "https://studentaid.gov/loan-simulator/borrow-more/wizard/loan-info/confirm-current-loan/current",
      "fields": [
        {
          "label": "Current Loans",
          "field_id": "current_loans",
          "selector": "#loan_table",
          "field_type": "group",
          "interaction": "click",
          "required": false,
          "example_value": [
            {
              "loan_type": "Direct Unsubsidized Loan",
              "loan_interest_rate": "5.5",
              "loan_balance": "10000"
            }
          ],
          "notes": "Repeatable loan entry. Click 'Add a Loan' to add each loan. Can add multiple loans (0 to unlimited). Each loan can be edited or removed after saving.",
          "sub_fields": [
            {
              "field_id": "loan_type",
              "selector": "#fsa_Select_LoanSimulatorUserAddedLoanType",
              "field_type": "select",
              "interaction": "select",
              "example_value": "Direct Unsubsidized Loan",
              "notes": "Type of federal or private student loan"
            },
            {
              "field_id": "loan_interest_rate",
              "selector": "#fsa_Input_LoanSimulatorUserAddedInterestRate",
              "field_type": "text",
              "interaction": "fill",
              "example_value": "5.5",
              "notes": "Interest rate as percentage without % symbol"
            },
            {
              "field_id": "loan_balance",
              "selector": "#fsa_Input_LoanSimulatorUserAddedPrincipalBalance",
              "field_type": "text",
              "interaction": "fill",
              "example_value": "10000",
              "notes": "Loan balance in dollars without $ symbol"
            }
          ],
          "repeatable": true,
          "add_button_selector": "#fsa_IconLinkButton_LoanSimulatorWizardLoansAddNewLoan",
          "remove_button_selector": "#fsa_Button_LoanSimulatorAddLoanRemove_{index}",
          "min_instances": 0
        }
      ],
      "continue_button": {
        "text": "Continue",
        "selector": "#fsa_Button_WizardContinue",
        "selector_type": "css"
      }
    }
  ]
}